{
  "version": "1.2.0-generated",
  "title": "Elliott Runtime — Connection Graph (generated)",
  "generatedFrom": "scripts/gen-topology.mjs: topology/topology.spine.json + skills/**/manifest.yaml spec.topology + agents/elliott.yaml mcp[] + config/elliott.yaml gates",
  "note": "Auto-generated structural connection graph. Nodes/uniform-edges derive from each module's manifest; the runtime spine is hand-authored. `runtime` here is a static approximation (secret-gated => config-gated); the live deep-trace extension resolves actual liveness.",
  "nodeKinds": [
    "secret-source",
    "gateway",
    "runtime",
    "agent-loop",
    "provider",
    "tool",
    "service",
    "mcp-endpoint",
    "memory",
    "database",
    "learning",
    "evaluator",
    "extension",
    "observability",
    "container"
  ],
  "edgeKinds": [
    "data",
    "control",
    "persist",
    "learn",
    "health",
    "secret"
  ],
  "nodes": [
    {
      "id": "secret.vault",
      "name": "Vault secret source (configured KV path)",
      "kind": "secret-source",
      "runtime": "live",
      "domain": "secrets",
      "source": "src/runtime/config.ts"
    },
    {
      "id": "runtime.http",
      "name": "Bun.serve -> #handleRequest (single HTTP server)",
      "kind": "runtime",
      "runtime": "live",
      "domain": "ingress",
      "source": "src/runtime/server.ts:7; src/runtime/app.ts:336"
    },
    {
      "id": "runtime.inbound",
      "name": "#handleInbound (dedup + snapshot pin + turn open)",
      "kind": "runtime",
      "runtime": "live",
      "domain": "ingress",
      "source": "src/runtime/app.ts:246"
    },
    {
      "id": "runtime.agentLoop",
      "name": "RuntimeAgent.turn (round loop <= 8)",
      "kind": "agent-loop",
      "runtime": "live",
      "domain": "agent-core",
      "source": "src/runtime/agent.ts:43"
    },
    {
      "id": "runtime.prompt",
      "name": "Prompt assembly (#systemPrompt + contextualInput)",
      "kind": "runtime",
      "runtime": "live",
      "domain": "agent-core",
      "source": "src/runtime/agent.ts:91"
    },
    {
      "id": "runtime.router",
      "name": "Route attestation (#attest fixed {baseUrl, model})",
      "kind": "runtime",
      "runtime": "live",
      "domain": "model-inference",
      "source": "src/runtime/model/client.ts:64"
    },
    {
      "id": "runtime.modelClient",
      "name": "RuntimeModelClient.complete -> /v1/chat/completions",
      "kind": "runtime",
      "runtime": "live",
      "domain": "model-inference",
      "source": "src/runtime/model/client.ts:23"
    },
    {
      "id": "runtime.toolExec",
      "name": "#execute (tool dispatch; Promise.all fan-out in turn)",
      "kind": "runtime",
      "runtime": "live",
      "domain": "agent-core",
      "source": "src/runtime/agent.ts:105"
    },
    {
      "id": "runtime.kernel",
      "name": "AgentKernel (boot + snapshots + evolution; turn path bypasses it)",
      "kind": "runtime",
      "runtime": "live",
      "domain": "kernel-governance",
      "source": "src/runtime/kernel.ts:4; src/kernel.ts:36"
    },
    {
      "id": "provider.litellm",
      "name": "LiteLLM gateway (configured llm.base_url)",
      "kind": "provider",
      "runtime": "live",
      "domain": "model-inference",
      "source": "config/elliott.yaml:16; src/runtime/model/client.ts:28"
    },
    {
      "id": "provider.ollama",
      "name": "Ollama provider (canonical-only; never instantiated)",
      "kind": "provider",
      "runtime": "dormant",
      "domain": "model-inference",
      "source": "src/providers/ollama/index.ts:13"
    },
    {
      "id": "memory.sessionStore",
      "name": "SessionStore (bun:sqlite, WAL; only .evolution sub-store consumed)",
      "kind": "memory",
      "runtime": "live",
      "domain": "memory-persistence",
      "source": "src/memory/session-store/index.ts:37; app.ts:77"
    },
    {
      "id": "memory.evidence",
      "name": "RuntimeEvolutionEvidence sink (wraps the TurnObserver)",
      "kind": "memory",
      "runtime": "live",
      "domain": "memory-persistence",
      "source": "src/runtime/evolution-evidence.ts:26; app.ts:125"
    },
    {
      "id": "memory.curated",
      "name": "Curated memory (MEMORY.md / USER.md) - library-only",
      "kind": "memory",
      "runtime": "dormant",
      "domain": "memory-persistence",
      "source": "src/memory/curated/index.ts:41"
    },
    {
      "id": "memory.snapshots",
      "name": "Snapshots (FileSnapshotStore; per-conversation in-memory ID pin)",
      "kind": "memory",
      "runtime": "live",
      "domain": "memory-persistence",
      "source": "src/core/snapshot/snapshot.ts:125; src/runtime/conversation-snapshots.ts:4"
    },
    {
      "id": "database.sessions",
      "name": "sessions.sqlite (5 evolution tables written at runtime)",
      "kind": "database",
      "runtime": "live",
      "domain": "memory-persistence",
      "source": ".elliott-runtime/sessions.sqlite; DDL session-store/index.ts:25 + evolution.ts:12"
    },
    {
      "id": "learning.signals",
      "name": "Evolution signal detection (evolution-signals.ts via scheduler)",
      "kind": "learning",
      "runtime": "live",
      "domain": "self-evolution",
      "source": "src/runtime/evolution-signals.ts:113; evolution-scheduler.ts:210"
    },
    {
      "id": "learning.triage",
      "name": "Evolution signal triage (score + gate; top-scored)",
      "kind": "learning",
      "runtime": "live",
      "domain": "self-evolution",
      "source": "src/learning/evolution/continuous/triage.ts:22"
    },
    {
      "id": "learning.proposals",
      "name": "Proposals (FileProposalStore) -> canary -> promote/rollback",
      "kind": "learning",
      "runtime": "live",
      "domain": "self-evolution",
      "source": "src/learning/proposals/index.ts:18; src/runtime/evolution.ts:342"
    },
    {
      "id": "learning.control",
      "name": "Evolution control plane (/v1/control/evolution, token-gated)",
      "kind": "learning",
      "runtime": "config-gated",
      "domain": "self-evolution",
      "source": "src/runtime/evolution.ts:500; app.ts:350"
    },
    {
      "id": "evaluator.gauntlet",
      "name": "Evolution evaluation (orchestrator.evaluate -> harness -> HTTP evaluator)",
      "kind": "evaluator",
      "runtime": "live",
      "domain": "self-evolution",
      "source": "src/learning/evolution/orchestrator/operations.ts:128; evaluation/harness.ts"
    },
    {
      "id": "obs.telemetry",
      "name": "RuntimeTelemetry bus (in-process pub/sub, ring, SSE)",
      "kind": "observability",
      "runtime": "live",
      "domain": "observability",
      "source": "src/runtime/telemetry.ts:16"
    },
    {
      "id": "obs.footprint",
      "name": "FootprintTracker (in-memory; instantiated in kernel, unfed)",
      "kind": "observability",
      "runtime": "dormant",
      "domain": "kernel-governance",
      "source": "src/observability/index.ts:33; src/kernel.ts:52"
    },
    {
      "id": "obs.audit",
      "name": "AuditLog (hash-chained, Merkle, in-memory; kernel+evolution only)",
      "kind": "observability",
      "runtime": "live",
      "domain": "kernel-governance",
      "source": "src/audit/log.ts:25; src/kernel.ts:41"
    },
    {
      "id": "obs.reporter",
      "name": "Error reporter (Sentry-compatible DSN) via #capture",
      "kind": "observability",
      "runtime": "live",
      "domain": "observability",
      "source": "src/runtime/reporter.ts:5; app.ts:361"
    },
    {
      "id": "container.elliott",
      "name": "elliott app container (runtime.http port)",
      "kind": "container",
      "runtime": "live",
      "domain": "deployment-substrate",
      "source": "deploy/docker-compose.yml:4"
    },
    {
      "id": "container.postgres",
      "name": "postgres (pgvector) - declared; no runtime reader",
      "kind": "container",
      "runtime": "declared",
      "domain": "deployment-substrate",
      "source": "deploy/docker-compose.yml:49"
    },
    {
      "id": "container.browser",
      "name": "agent-browser (browserless/chromium; isolated network)",
      "kind": "container",
      "runtime": "live",
      "domain": "deployment-substrate",
      "source": "deploy/docker-compose.yml:65"
    },
    {
      "id": "obs.map",
      "name": "deep-trace (skills/deep-trace/src/index.ts)",
      "kind": "observability",
      "runtime": "live",
      "domain": "observability",
      "source": "skills/deep-trace/src/index.ts",
      "classifications": {
        "trustZone": "edge",
        "dataClassification": "operational-metadata",
        "criticality": "supporting"
      }
    },
    {
      "id": "evaluator.benchmarks",
      "name": "evaluator-agent-benchmarks (skills/evaluator-agent-benchmarks/src/index.ts)",
      "kind": "evaluator",
      "runtime": "config-gated",
      "domain": "self-evolution",
      "source": "skills/evaluator-agent-benchmarks/src/index.ts",
      "classifications": {
        "trustZone": "egress",
        "dataClassification": "internal",
        "criticality": "latent"
      },
      "egressTargets": [
        "benchmarks companion (HTTP, sealed OCI)"
      ]
    },
    {
      "id": "evaluator.darwinian",
      "name": "evaluator-darwinian (skills/evaluator-darwinian/src/index.ts)",
      "kind": "evaluator",
      "runtime": "config-gated",
      "domain": "self-evolution",
      "source": "skills/evaluator-darwinian/src/index.ts",
      "classifications": {
        "trustZone": "egress",
        "dataClassification": "internal",
        "criticality": "latent"
      },
      "egressTargets": [
        "darwinian companion (HTTP, sealed OCI)"
      ]
    },
    {
      "id": "evaluator.dspy",
      "name": "evaluator-dspy (skills/evaluator-dspy/src/index.ts)",
      "kind": "evaluator",
      "runtime": "config-gated",
      "domain": "self-evolution",
      "source": "skills/evaluator-dspy/src/index.ts",
      "classifications": {